_id,_name,_shortName,_kana,_artist,_detailInfo,_dictionaryReference,_dictionaryComment,_bandCategory,_masterGroupId,_jacketImageName,_masterBgmId,_previewMasterBgmId,_locked,_obtainType,_isAcLevelMusic,_releaseDateTime,_masterReleaseLabelId
2024,Dragon Riders,Dragon Riders,Dragon Riders,CYaRon!,Lyrics: Aki Hata<br>Composition: TAKUYA and mito (Clammbom)<br>Arrangement: mito,Love Live! Sunshine!! CYaRon! 1st Full Album: B-Side,"This song brings the energy in a homage to Hong Kong kung fu films. It is performed live with Chinese-inspired dresses to match the distinctive sounds of the erhu and gong. The final call where ""acho"" turns ""sharoon"" is a complete ear worm.",2,201,jacket_2153,31002024,32002024,0,0,0,2021/06/02,1
2025,metamorphism,metamorphism,metamorphism,AZALEA,Lyrics: Aki Hata<br>Composition / Arrangement: TO-me,Love Live! Sunshine!! AZALEA 1st Full Album: B-Side,"As a butterfly emerges from its chrysalis and wings its way to the sky, the message of this mid-tempo, future bass-inspired tune is to come out of your shell and try new things. Metamorphosis encompasses both internal change and transformation into something completely new.",2,202,jacket_2023,31002025,32002025,0,0,0,2021/06/23,1
2026,Whistle of Revolution,Whistle of Revolution,Whistle of Revolution,CYaRon!,Lyrics: Aki Hata<br>Composition / Arrangement: TAKUYA,Love Live! Sunshine!! CYaRon! 1st Full Album: B-Side,"In a rare move for CYaRon!, this song is brought together with the stable foundation of its simple, pop-rock sound. The guitar riffs in the intro make for a memorable beginning. Like a whistle blowing to signal the start of a race, this song stresses the importance of pushing oneself to follow their dreams.",2,201,jacket_2153,31002026,32002026,0,0,0,2021/06/02,1
2027,OKAWARI Happy life!,OKAWARI Happy life!,OKAWARI Happy life!,Chika Takami (C.V: Anju Inami),"Lyrics: Aki Hata<br>Composition: Koudai Iwatsubo, TAKAROT and Shoma Yamamoto<br>Arrangement: Shoma Yamamoto and TAKAROT",Aqours Second Solo Concert Album Love Live! Sunshine!! Second Solo Concert Album ~THE STORY OF FEATHER~ starring Chika Takami,"In this musical-inspired number evocative of a sequel to One More Sunshine Story, Chika never stops moving forward through character growth and pushing herself to try new things.",2,290,jacket_2027,31002027,32002027,0,0,0,2021/08/01,1
2028,Love Spiral Tower,Love Spiral Tower,Love Spiral Tower,Riko Sakurauchi (C.V: Rikako Aida),Lyrics: Aki Hata<br>Composition / Arrangement: Ayumu Nakamura and Hiroto Kikuchi,Aqours Second Solo Concert Album Love Live! Sunshine!! Second Solo Concert Album ~THE STORY OF FEATHER~ starring Riko Sakurauchi,"This swing jazz approach will get you on your feet before you know it! This song stands out for its speech-like singing style. By comparing the pursuit of a forbidden love to a spiral tower, this song unfolds in a thrilling, racing fashion.",2,290,jacket_2028,31002028,32002028,0,0,0,2021/09/19,1
2029,Amazing Travel DNA,Amazing Travel DNA,Amazing Travel DNA,AZALEA,Lyrics: Aki Hata<br>Composition / Arrangement: Ryuhey Yamada,Smartphone App Love Live! School Idol Festival Collaboration Single,"Through a comparison of journeying into the future to traveling, this song portrays a meandering journey into worlds unknown, making it the perfect background music for when your travels take you off the beaten path. The techno-pop sound is jam-packed with AZALEA's flair.",2,202,jacket_2029,31002029,32002029,0,0,0,2019/12/11,1
2030,Aqours Pirates Desire,Aqours Pirates Desire,Aqours Pirates Desire,Aqours,Lyrics: Aki Hata<br>Composition: TAKAROT and Koudai Iwatsubo<br>Arrangement: TAKAROT,Love Live! Sunshine!! Aqours 6th Love Live! Dome Tour Theme Songs CD<br>,"No Aqours song up until now has ever been as swashbuckling as this tale of a pirate sailing the seven seas for treasure. When performed live, all the Aqours girls waved flags. But Shuka Saito (You Watanabe's actor) waved a flag larger than herself in a truly impressive fashion.",2,200,jacket_2130,31002030,32002030,0,0,0,2020/07/22,1
2031,Daydream Warrior,Daydream Warrior,Daydream Warrior,Aqours,Lyrics: Aki Hata<br>Composition: Wataru Maeguchi<br>Arrangement: Tomohiro Nakatsuchi,Love Live! Sunshine!! Anime Season 1 Blu-Ray Volume 4: Aqours Original Songs CD 4,"A song from the Love Love! Sunshine!! Anime Season 1 Blu-Ray Volume 4 Aqours Original Songs CD. Yoshiko performs the center role in this aggressive, full-scale EDM song. The live performances feature lots of fun extras, such as snappy dance moves in the instrumental section or intros unique to the performance.",2,200,jacket_2031,31002031,32002031,0,0,0,2016/12/22,1
2032,G Senjono Cinderella,G Senjono Cinderella,G Senjono Cinderella,"Kanan Matsuura (C.V: Nanaka Suwa), Dia Kurosawa (C.V: Arisa Komiya), and Mari Ohara (C.V: Aina Suzuki)",Lyrics: Aki Hata<br>Composition: Takayuki Ishikura<br>Arrangement: Ramseeni and Takayuki Ishikura,Love Live! Sunshine!! Anime Season 1 Blu-Ray Volume 5: Aqours Original Songs CD 5,"This song is the result of the three third years imagining a dance party on a ship. In live performances, the other Aqours girls join hands and dance together. This fun tune hearkens to Broadway musical show tunes with its upbeat instruments.",2,299,jacket_2032,31002032,32002032,0,0,0,2017/01/27,1
2033,Thrilling One-way,Thrilling One-way,Thrilling One-way,Aqours,Lyrics: Aki Hata<br>Composition / Arrangement: Ryouta Fujii and Kotaro Odaka,Love Live! Sunshine!! Anime Season 1 Blu-Ray Volume 6: Aqours Original Songs CD 6,"From Chika's opening call of ""We all want to shine!"" to the final moment, this rock song is one nonstop dash. In live shows, the wild guitar playing and dancing in the third verse are must-sees.",2,200,jacket_2033,31002033,32002033,0,0,0,2017/02/24,1
2034,Taiyo o Oi kakero!,Taiyo o Oi kakero!,Taiyo o Oi kakero!,Aqours,Lyrics: Aki Hata<br>Composition / Arrangement: Akito Matsuda,Love Live! Sunshine!! Anime Season 1 Blu-Ray Volume 7: Aqours Original Songs CD 7,"Chika kicks off the song with her call ""Aqours, assemble!"" whereupon all the girls bow and march off towards the sun. In live shows, the girls wave their hands from side to side, producing an incredible unified performance.",2,200,jacket_2034,31002034,32002034,0,0,0,2017/03/24,1
2035,HAPPY PARTY TRAIN,HAPPY PARTY TRAIN,HAPPY PARTY TRAIN,Aqours,Lyrics: Aki Hata<br>Composition: Takuya Watanabe<br>Arrangement: EFFY,Aqours 3rd Single,"Aqours' third single. Kanan was chosen to play the song's center role through a poll. The melancholy melody forewarning departure and the world building described by the lyrics are especially memorable. This song was first toured in Aqours second tour, also called HAPPY PARTY TRAIN, in which they literally rode the train all across Japan to meet fans everywhere.",2,200,jacket_2035,31002035,32002035,0,0,0,2017/04/05,1
2036,Humming Friend,Humming Friend,Humming Friend,Aqours,Lyrics: Aki Hata<br>Composition: Satoru Kuwabara (Arte Refact)<br>Arrangement: Takuya Sakai (Arte Refact),Love Live! Sunshine!! Anime Opening Theme: B-Side,"The B-side of Aozora Jumping Heart, an invigorating techno-pop song about friendship. The modernistic elements such as the cuts combine with the sentimental, dramatic developments to make a true bop.",2,200,jacket_2096,31002036,32002036,0,0,0,2016/07/20,1
2037,Sunshine Pikkapika Ondo,Sunshine Pikkapika Ondo,Sunshine Pikkapika Ondo,Aqours,Lyrics: Aki Hata<br>Composition: Masumi Itou<Arrangement>: EFFY,Love Live! Sunshine!! Anime Ending Theme: B-Side,"With memorable solos for each of the 9 Aqours girls, this marching song boasts a choreography that is super easy to learn. At Aqours 2nd Love Live!, Uchicchi showed up carrying a huge fan, making the crowd go wild.",2,200,jacket_2098,31002037,32002037,0,0,0,2016/08/24,1
2038,Landing action Yeah!!,Landing action Yeah!!,Landing action Yeah!!,Aqours,Lyrics: Aki Hata<br>Composition: Hajime Mitsumasu<br>Arrangement: TAKAROT,Aqours Next Step! Project Theme Songs CD,"The theme song for fan meet-ups between 2017 and 2018. Mari's line of ""Where to next?"" not only questions where the next fan meet-up will be held but also what Aqours' next steps are.",2,200,jacket_2038,31002038,32002038,0,0,0,2017/06/30,1
2039,Kinmirai Happy End,Kinmirai Happy End,Kinmirai Happy End,CYaRon!,Lyrics: Aki Hata<br>Composition / Arrangement: Ryouta Fujii,CYaRon! 2nd Single,"This song tells a story of a ""me"" who cheers on a ""you"" with little experience in love. In live performances, all the girls twirl a large flag. This tune gets listeners going with its upbeat techno rhythm.",2,201,jacket_2039,31002039,32002039,0,0,0,2017/05/10,1
2040,KOWAREYASUKI,KOWAREYASUKI,KOWAREYASUKI,Guilty Kiss,Lyrics: Aki Hata<br>Composition / Arrangement: Takashi Saeki,Guilty Kiss 2nd Single,"This song offers a strong message of protecting the audience when they feel scared and confused. Combined with the powerful sound evocative of nu metal and mixture rock, the fade-in intro is sure to jazz the listener.",2,203,jacket_2040,31002040,32002040,0,0,0,2017/06/21,1
2041,SKY JOURNEY,SKY JOURNEY,SKY JOURNEY,Aqours,Lyrics: Aki Hata<br>Composition / Arrangement: Hirotaka Hayakawa,Aqours 3rd Single,"The B-side of HAPPY PARTY TRAIN. This tune feels almost mystical, with its lyrics that paint an image of a journey to chase one's dreams and a sentimental melody. It continues the story from the A-side, taking the next stage of the trip into space.",2,200,jacket_2035,31002041,32002041,0,0,0,2017/04/05,1
2042,Shojo Ijo no Koi ga Shitai,Shojo Ijo no Koi ga Shitai,Shojo Ijo no Koi ga Shitai,Aqours,Lyrics: Aki Hata<br>Composition: TAKAROT and Koudai Iwatsubo<br>Arrangement: TAKAROT and Shinji Tanaka,Aqours 3rd Single,The B-side of HAPPY PARTY TRAIN. This love song is memorable for its lyrics which are as candid as they are adorable. The synth-pop sound is just as cute and filled with dazzling twists and turns.,2,200,jacket_2035,31002042,32002042,0,0,0,2017/04/05,1
2043,GALAXY HidE and SeeK,GALAXY HidE and SeeK,GALAXY HidE and SeeK,AZALEA,Lyrics: Aki Hata<br>Composition / Arrangement: Yoshinobu Takeichi,AZALEA 2nd Single,"AZALEA's second single, a techno-pop song that strikes a balance between reservation and optimism in a manner AZALEA is known for. The authentic electronic touch sits side-by-side with the more orthodox vocals for a truly magical song.",2,202,jacket_2043,31002043,32002043,0,0,0,2017/05/31,1
2044,Mirai no Bokura wa Shitteru yo,Mirai no Bokura wa Shitteru yo,Mirai no Bokura wa Shitteru yo,Aqours,Lyrics: Aki Hata<br>Composition: Hajime Mitsumasu<br>Arrangement: EFFY,Love Live! Sunshine!! Anime Season 2 Opening Theme,"The line ""Let's strive for a future where we can compete with everything we have"" televises the burning frustration the Aqours girls felt when they weren't able to compete in the first season of the anime. The song describes their efforts to achieve their dream.",2,200,jacket_2044,31002044,32002044,0,0,0,2017/10/25,1
2045,Yuki wa Doko ni? Kimi no Mune ni!,Yuki wa Doko ni? Kimi no Mune ni!,Yuki wa Doko ni? Kimi no Mune ni!,Aqours,Lyrics: Aki Hata<br>Composition: Kotaro Odaka and UiNA<br>Arrangement: Kotaro Odaka,Love Live! Sunshine!! Anime Season 2 Ending Theme,"This song catalogues the Aqours' girls' character development over the course of their many setbacks. When this song is sung in the anime at the school closing festival, the line ""I'm leaving nothing undone"" applies both to their feelings about being Aqours idols and being students of Uranohoshi High.",2,200,jacket_2045,31002045,32002045,0,0,0,2017/11/15,1
2046,MY Mai☆TONIGHT,MY Mai☆TONIGHT,MY Mai☆TONIGHT,Aqours,Lyrics: Aki Hata<br>Composition / Arrangement: EFFY,Love Live! Sunshine!! Anime Season 2: Episode 3 Soundtrack,"The first classically Japanese-themed song to appear in the anime. It is preceded by a scene that shows the intense bond between the Kurosawa sisters, thus making the opening lines a kind of match point for them. The rock sound is perfect for dancing and shines through the koto and shakuhachi sounds.",2,200,jacket_2046,31002046,32002046,0,0,0,2017/11/29,1
2047,Shadow gate to love,Shadow gate to love,Shadow gate to love,Guilty Kiss,Lyrics: Aki Hata<br>Composition / Arrangement: Kazunori Watanabe,Guilty Kiss 2nd Single,"The lines ""I've set a trap"" and ""I bet you've gotten enthralled"" perfectly exemplify the bold, assertive approach Guilty Kiss takes in this song. It is especially well known for its live performances, where each girl makes a heart and releases them to the fans.",2,203,jacket_2040,31002047,32002047,0,0,0,2017/06/21,1
2048,Natsu e no Tobira: Never end ver.,Natsu e no Tobira: Never end ver.,Natsu e no Tobira: Never end ver.,"Riko Sakurauchi (C.V: Rikako Aida), Hanamaru Kunikida (C.V: Kanako Takatsuki), and Mari Ohara (C.V: Aina Suzuki)",Lyrics: Aki Hata<br>Composition / Arrangement: Masashi Kanasaki,Love Live! Sunshine!! Duo Trio Collection CD Vol. 1: SUMMER VACATION,"This song creates an image of Riko, Hanamaru, and Mari all having a delightful time at the seashore. In its memorable performance at Aqours 2nd Love Live!, the girls rode a trolley and sprayed the audience with water guns.",2,299,jacket_2048,31002048,32002048,0,0,0,2017/08/02,1
2049,Manatsu wa Dare no Mono?,Manatsu wa Dare no Mono?,Manatsu wa Dare no Mono?,Dia Kurosawa (C.V: Arisa Komiya) and Ruby Kurosawa (C.V: Ai Furihata),Lyrics: Aki Hata<br>Composition / Arrangement: Atsushi Harada (Arte Refact),Love Live! Sunshine!! Duo Trio Collection CD Vol. 1: SUMMER VACATION,A song off the summer-themed album Love Live! Sunshine!! Duo Trio Collection CD Vol. 1: Summer Vacation. This mid-tempo tune features the Kurosawa sisters with Latinesque music. Their live show costumes and dances also draw inspiration from other cultures.,2,299,jacket_2048,31002049,32002049,0,0,0,2017/08/02,1
2050,Jimoai Mantan Summer Life,Jimoai Mantan Summer Life,Jimoai Mantan Summer Life,You Watanabe (C.V: Shuka Saito) and Yoshiko Tsushima (C.V: Aika Kobayashi),Lyrics: Aki Hata<br>Composition / Arrangement: Takayuki Ishikura,Love Live! Sunshine!! Duo Trio Collection CD Vol. 1: SUMMER VACATION,"This song is evocative of You and Yoshiko spending a delightful summer day without a care in the world. In live shows, their costumes feature horns and tails for a unicorn theme. The tropical tune has many other such memorable elements like the ukuleles and dancing seasoned with local pride.",2,299,jacket_2048,31002050,32002050,0,0,0,2017/08/02,1
2051,Natsu no Owari no Amaoto ga,Natsu no Owari no Amaoto ga,Natsu no Owari no Amaoto ga,Chika Takami (C.V: Anju Inami) and Kanan Matsuura (C.V: Nanaka Suwa),Lyrics: Aki Hata<br>Composition: Shuutarou Katagiri<br>Arrangement: Kotaro Egami,Love Live! Sunshine!! Duo Trio Collection CD Vol. 1: SUMMER VACATION,"This song brings a melancholy vibe with Kanan's ""It's over,"" and Chika's ""That summer sure was fun."" The bouncy EDM-esque live performance included the running man move, shocking fans.",2,299,jacket_2048,31002051,32002051,0,0,0,2017/08/02,1
2052,MIRACLE WAVE,MIRACLE WAVE,MIRACLE WAVE,Aqours,Lyrics: Aki Hata<br>Composition: Takuya Sakai (Arte Refact)<br>Arrangement: Masatomi Waki (Arte Refact),Love Live! Sunshine!! Anime Season 2: Episode 6 Soundtrack,This song describes Aqours taking on new things and produced a powerful impact with its dolphin choreography and Chika's backflip. It was performed at all shows on the Aqours 3rd Love Live! Tour and made the audience cheer with its choreography.,2,200,jacket_2046,31002052,32002052,0,0,0,2017/11/29,1
2053,Awaken the power,Awaken the power,Awaken the power,Saint Aqours Snow,Lyrics: Aki Hata<br>Composition / Arrangement: Takahiro Kawata,Love Live! Sunshine!! Anime Season 2: Episode 9 Soundtrack,"This song came to be after Saint Snow failed to place in the Love Live qualifying tournament due to a mistake Leah made during her performance. Ruby told her, ""Then, you can just make sure it's not the last performance, right?!"" and the rest is history.",2,205,jacket_2053,31002053,32002053,0,0,0,2017/12/20,1
2054,One More Sunshine Story,One More Sunshine Story,One More Sunshine Story,Chika Takami (C.V: Anju Inami),Lyrics: Aki Hata<br>Composition / Arrangement: EFFY (FirstCall),Love Live! Sunshine!! Anime Season 2 Blu-Ray Volume 1: Aqours Original Songs CD 1,"From the intro, evocative of upending a toy chest, to the classic Chika energy, this song uses the theme of shining to depict her feelings in a single musical number. The rapid-fire melody and singing make it seem like a song performed live.",2,290,jacket_2054,31002054,32002054,0,0,0,2017/12/22,1
2055,WATER BLUE NEW WORLD,WATER BLUE NEW WORLD,WATER BLUE NEW WORLD,Aqours,Lyrics: Aki Hata<br>Composition / Arrangement: Takashi Saeki<br>Strings Arrangement：Tatsuya Kurauchi,Love Live! Sunshine!! Anime Season 2: Episode 12 Soundtrack,"Sung to win the Love Live! championship, this song sends the message that it will be the third years final competition. One live performance featured a rain of blue feathers while in another fans used their penlights to create a huge ship crossing the ocean as in the line ""Let's cross the sea.""",2,200,jacket_2055,31002055,32002055,0,0,0,2018/01/17,1
2056,WONDERFUL STORIES,WONDERFUL STORIES,WONDERFUL STORIES,Aqours,Lyrics: Aki Hata<br>Composition: Carlos K.<br>Arrangement: EFFY,Love Live! Sunshine!! Anime Season 2: Episode 13 Soundtrack,"This song is a throwback, containing all the costumes worn during songs performed in the anime, to Aqours chasing their dreams. In live shows, the audience joins in the singers from the third verse on for all parts but Chika's, creating an incredible spectacle.",2,200,jacket_2055,31002056,32002056,0,0,0,2018/01/17,1
2057,Oyasuminasan!,Oyasuminasan!,Oyasuminasan!,Hanamaru Kunikida (C.V: Kanako Takatsuki),Lyrics: Aki Hata<br>Composition / Arrangement: Satoru Shirasuka and Motoki Masuda,Love Live! Sunshine!! Anime Season 2 Blu-Ray Volume 2: Aqours Original Songs CD 2,"The words ""by your side"" and ""smiling at one another"" inevitably conjure an image of Hanamaru addressing this song to someone else. It's easy to imagine her falling asleep looking forward to spending her tomorrows with that special someone.",2,290,jacket_2057,31002057,32002057,0,0,0,2018/01/26,1
2058,Kaigandori de Matteru yo,Kaigandori de Matteru yo,Kaigandori de Matteru yo,CYaRon!,Lyrics: Aki Hata<br>Composition / Arrangement: Miki Watanabe,CYaRon! 2nd Single: B-Side,"This song tells the story of a stubborn girl who has a fight with a loved one and now wants to make up. During the chorus in live performances, the singers salute and wave the three fingers of the opposite hand while the audience cheers for resolution.",2,201,jacket_2039,31002058,32002058,0,0,0,2017/05/10,1
2059,Kimi no Hitomi o Meguru Boken,Kimi no Hitomi o Meguru Boken,Kimi no Hitomi o Meguru Boken,Aqours,Lyrics: Aki Hata<br>Composition / Arrangement: Kazunori Watanabe,Love Live! Sunshine!! Anime Season 2 Opening Theme: B-Side,"The main theme of Real Escape Game x Love Live! Sunshine!! Escape from the Island Aquarium. In accordance with that theme, the other girls create a maze with their choreography for Riko to traverse.",2,200,jacket_2044,31002059,32002059,0,0,0,2017/10/25,1
2060,in this unstable world,in this unstable world,in this unstable world,Yoshiko Tsushima (C.V: Aika Kobayashi),Lyrics: Aki Hata<br>Composition / Arrangement: Rei Kamiya,Love Live! Sunshine!! Anime Season 2 Blu-Ray Volume 3: Aqours Original Songs CD 3,"This song imagines what future awaits Yoshiko Tsushima and the multiple characters that make up her (Yoshiko, Yohane, etc.) To illustrate that she isn't alone, the song uses ""you"" and ""I"" throughout. The instrumental portion of this EDM song seems perfect for large musical festivals, as it encourages the audience to jump up and down.",2,290,jacket_2060,31002060,32002060,0,0,0,2018/02/23,1
2061,Pianoforte Monologue,Pianoforte Monologue,Pianoforte Monologue,Riko Sakurauchi (C.V: Rikako Aida),Lyrics: Aki Hata<br>Composition / Arrangement: Hironori Aoki and Yuya Hirozawa,Love Live! Sunshine!! Anime Season 2 Blu-Ray Volume 3: Aqours Original Songs CD 3,"The outfit Riko wears and her line about ""I face the keyboard alone"" almost connects it like a monologue to Omoiyo Hitotsuninare. ""I want to embrace you through my music"" is directed at Chika, who gave Riko the strength to keep playing the piano.",2,290,jacket_2061,31002061,32002061,0,0,0,2018/02/23,1
2062,Beginner's Sailing,Beginner's Sailing,Beginner's Sailing,You Watanabe (C.V: Shuka Saito),Lyrics: Aki Hata<br>Composition / Arrangement: Takuya Sakai (Arte Refact),Love Live! Sunshine!! Anime Season 2 Blu-Ray Volume 4: Aqours Original Songs CD 4,"The guitar sound in this song is full of You Watanabe's characteristic high energy. In the 3rd live show tour, she shocked the audience by leaping off stage. Check out the carefree vocals in the chorus, too.",2,290,jacket_2062,31002062,32002062,0,0,0,2018/03/23,1
2063,RED GEM WINK,RED GEM WINK,RED GEM WINK,Ruby Kurosawa (C.V: Ai Furihata),Lyrics: Aki Hata<br>Composition / Arrangement: Kyo Takada,Love Live! Sunshine!! Anime Season 2 Blu-Ray Volume 5: Aqours Original Songs CD 5,"This song tells a story of a girl who dreams of love. The line ""I have to speak up"" when sung by Ruby paints a picture of her shyness. Many fans commented on her live performance of this song, as she wore the same outfit she wore on her trip to Tokyo in the first season.",2,290,jacket_2063,31002063,32002063,0,0,0,2018/04/24,1
2064,WHITE FIRST LOVE,WHITE FIRST LOVE,WHITE FIRST LOVE,Dia Kurosawa (C.V: Arisa Komiya),Lyrics: Aki Hata<br>Composition / Arrangement: Takuya Watanabe,Love Live! Sunshine!! Anime Season 2 Blu-Ray Volume 5: Aqours Original Songs CD 5,This song tells the story of the speaker falling in love for the first time. The mid-tempo ballad described her feelings changing from being attracted by their shared qualities to fear that the other party is oblivious to her feelings before finally ending with the realization that she wants to express her evolving feelings.,2,290,jacket_2064,31002064,32002064,0,0,0,2018/04/24,1
2065,INNOCENT BIRD,INNOCENT BIRD,INNOCENT BIRD,AZALEA,Lyrics: Aki Hata<br>Composition: Tetsushi Enami<br>Arrangement: Tatsuya Kurauchi,AZALEA 2nd Single: B-Side,"This techno-pop tune compares opening one's heart to being a bird with imagery involving hatching from an egg and unfolding one's damp wings. Finally, the singers' voices become more confident with the last spoken phrase, ""Say yes!""",2,202,jacket_2043,31002065,32002065,0,0,0,2017/05/31,1
2066,New winding road,New winding road,New winding road,Mari Ohara (C.V: Aina Suzuki),Lyrics: Aki Hata<br>Composition / Arrangement: Makoto Miyazaki,Love Live! Sunshine!! Anime Season 2 Blu-Ray Volume 6: Aqours Original Songs CD 6,"This mellow ballad creates a very optimistic image with its lyrics about looking forward and setting off. When it was performed at the 3rd live show tour, many fans were taken by Mari's whispered ""Thank you"" at the end.",2,290,jacket_2066,31002066,32002066,0,0,0,2018/05/25,1
2067,SAKANAKANANDAKA？,SAKANAKANANDAKA？,SAKANAKANANDAKA？,Kanan Matsuura (C.V: Nanaka Suwa),Lyrics: Aki Hata<br>Composition / Arrangement: Tetsuya Shitara,Love Live! Sunshine!! Anime Season 2 Blu-Ray Volume 6: Aqours Original Songs CD 6,This waltz-esque song evokes an image of Kanan in a fishy dress grabbing your hand and pulling you away for dancing and fun. It is particularly well-known in live performances for Kanan riding on a trolley through a sea of green fan light sticks.,2,290,jacket_2067,31002067,32002067,0,0,0,2018/05/25,1
2068,KISEKIHIKARU,KISEKIHIKARU,KISEKIHIKARU,Aqours,Lyrics: Aki Hata<br>Composition / Arrangement: Tatsuya Kato,Love Live! Sunshine!! Anime Season 2 Blu-Ray Volume 7: Aqours Original Songs CD 7,"This song featured in the movie with a melody inspired by the soundtrack of the second anime season. The line ""It's when you want to give up that you should make the really big changes"" captures the positive aspect of change.",2,200,jacket_2068,31002068,32002068,0,0,0,2018/06/22,1
2069,Hop Step Yippee!,Hop Step Yippee!,Hop Step Yippee!,Aqours,Lyrics: Aki Hata<br>Composition / Arrangement: Hajime Mitsumasu (FirstCall),Aqours Hop! Step! Jump! Project! Theme Songs CD,"Unlike the first fan meet-ups, this song delivers a different message: Let's all get together and strike out for the future! The choral choreography helps bring the audience together during live shows and fan meet-ups.",2,200,jacket_2069,31002069,32002069,0,0,0,2018/06/30,1
2070,Guilty Eyes Fever,Guilty Eyes Fever,Guilty Eyes Fever,Guilty Kiss,Lyrics: Aki Hata<br>Composition: Yuki Honda (Arte Refact)<br>Arrangement: Takuya Sakai (Arte Refact),Love Live! Sunshine!! Blu-ray Bonus: Guilty Kiss New Songs CD,"A song exclusive to the Love Live! Sunshine!! anime Blu-ray edition. This cool and cute dance tune incorporates serious EDM elements while never neglecting the mischievous, flirty angle Guilty Kiss is known for.",2,203,jacket_2070,31002070,32002070,0,0,0,2017/03/24,1
2071,SELF CONTROL!!,SELF CONTROL!!,SELF CONTROL!!,Saint Snow,Lyrics: Aki Hata<br>Composition / Arrangement: Takahiro Kawata,Love Live! Sunshine!! Anime Season 1 OST: Sailing to the Sunshine,A song that represents what Saint Snow is all about. Every angle of the song emphasizes how seriously they view being school idols. It isn't just a game for them. The balance of Sarah's singing and Leah's rapping creates a perfect synchronized effect.,2,204,jacket_2071,31002071,32002071,0,0,0,2016/11/30,1
