_id,_name,_shortName,_kana,_artist,_detailInfo,_dictionaryReference,_dictionaryComment,_bandCategory,_masterGroupId,_jacketImageName,_masterBgmId,_previewMasterBgmId,_locked,_obtainType,_isAcLevelMusic,_releaseDateTime,_masterReleaseLabelId
2169,Ao no Aurora,Ao no Aurora,Ao no Aurora,You Watanabe (C.V: Shuka Saito),Lyrics: Aki Hata<br>Composition: T4K<br>Arrangement: T4K,,"With the graduation of the third-year members of the group looming, You Watanabe feels a strong sense of duty for the second years to become leaders.<br>The lyrics weave the remaining members’ wish to guide the way and to become a lighthouse that the graduating members can always feel welcome coming home to... With a ship’s captain as a father whom she respects very much, this song has strong ties to You Watanabe.",2,290,jacket_2169,31002169,32002169,0,0,0,2023/04/17,223100303
2170,Mata Kimi ni Aunda,Mata Kimi ni Aunda,Mata Kimi ni Aunda,Mari Ohara (C.V: Aina Suzuki),"Lyrics: Aki Hata<br>Composition: Junya Maesako, Dr. Lilcom, and Hitoshi Harukawa<br>Arrangement: Dr. Lilcom",,"Mari returns to fulfill her promise to Dia and Kanan of winning Love Live! After securing an impressive victory with a nine-member Aqours that includes Chika’s group, Mari faces a new journey and her new life after graduation. This song and lyrics explore what’s in Mari’s heart during this moment.",2,290,jacket_2170,31002170,32002170,0,0,0,2023/06/13,223100303
2171,MABOROSHI wing,MABOROSHI wing,MABOROSHI wing,Yoshiko Tsushima (C.V: Aika Kobayashi),"Lyrics: Aki Hata<br>Composition: Junya Maesako, MARI, and Hitoshi Harukawa<br>Arrangement: MARI",,"At times, she's the cute innocent Angel. At other times, she's the ditzy Fallen Angel.<br>She's Yohane! The enigmatic girl who transcends space and time, traversing between reality and illusion. This is her new theme song ☆",2,290,jacket_2171,31002171,32002171,0,0,0,2023/07/13,223100303
2172,Fabotage,Fabotage,Fabotage,"YYY (You Watanabe (C.V: Shuka Saito), Yoshiko Tsushima (C.V: Aika Kobayashi), and Ruby Kurosawa (C.V: Ai Furihata))","Lyrics: Kaoru Kami<br>Composition: TOPHAMHAT-KYO (FAKE TYPE.), TAKAROT and RUSH EYE<br>Arrangement: RUSH EYE",,"B-side track included in theme song CD Waai WaiWai WaiWaiWai! recorded by radio personalities YYY (You Watanabe, Yoshiko Tsushima, Ruby Kurosawa). A song with YYY's signature upbeat style, featuring tons of 2020's wordplay making waves on the radio as well as social media.<br>*""Fabotage"" is a made-up word combining ""sabotage"" and ""favorite"" (referring to ""liking"" something on social media) to express sabotaging likes.",2,299,jacket_2164,31002172,32002172,0,0,0,2022/11/09,1
2173,Soramo Kokoromo Harerukara (9 Singers Ver.),Soramo Kokoromo Harerukara (9 Singers Ver.),Soramo Kokoromo Harerukara (9 Singers Ver.),Aqours,Lyrics: Aki Hata<br>Composition: Atsushi Harada (Arte Refact)<br>Arrangement: Masatomi Waki (Arte Refact),,"This played in the anime when the decision to close the school was finalized. The ""biting my lip"" and ""going to cry"" lyrics express the unease of taking on a challenge into a new feeling of having tried one's best and still coming up a bit short.<br>",2,200,jacket_2135,31002173,32002173,0,0,0,2020/10/07,1
2174,Omoiyo Hitotsuninare (9 Singers Ver.),Omoiyo Hitotsuninare (9 Singers Ver.),Omoiyo Hitotsuninare (9 Singers Ver.),Aqours,Lyrics: Aki Hata<br>Composition / Arrangement: Takashi Saeki,,"The song that couldn't be performed with the full group in the anime is playable now! At the 4th Love Live!, the second-years (yes, including Riko) started the singing off while Riko played piano, and then she joined the other eight onstage to dance alongside them. The performance truly did justice to the lyrics that go ""I really understand now, I am not alone.""<br>",2,200,jacket_2174,31002174,32002174,0,0,0,2022/02/16,1
2175,"SORA, FUJI, SUNSHINE!","SORA, FUJI, SUNSHINE!","SORA, FUJI, SUNSHINE!",Aqours,"Lyrics: Aki Hata<br>Composition: Junya Maesako, RUSH EYE, and Hitoshi Harukawa<br>Arrangement: RUSH EYE",,"Celebrating 8 years of Aqours! Mt. Fuji! Expanding Project ☆ theme song<br>8 years after its founding, Numazu and Aqours will expand just like the sprawling foothills of Mt. Fuji.<br>This song expresses the members’ desire for their music to reach as many people as possible ♪<br>They want everyone to clap along in the clapping sections. That, along with the 8-year celebratory cries of “Pachi pachi!”<br>make for a very lively song.",2,200,jacket_2175,31002175,32002175,0,0,0,2023/06/30,223100303
2176,Koini Naritai AQUARIUM (School Idol Festival AC),Koini Naritai AQUARIUM (School Idol Festival AC),Koini Naritai AQUARIUM,Aqours,Lyrics: Aki Hata<br>Composition: Yugo Sasakura<br>Arrangement: Kazunori Watanabe,Aqours 2nd Single,"The title song of Aqours 2nd single. This is also You Watanabe's first song in the center role, as was decided by the first ever Love Live! Sunshine!! center poll. Using the theme of an aquarium, this song paints a mental image of the fish and the girls having a blast dancing.",2,200,jacket_2088,31002176,32002176,0,0,1,2016/04/27,224012901
2177,Strawberry Trapper (School Idol Festival AC),Strawberry Trapper (School Idol Festival AC),Strawberry Trapper,Guilty Kiss,Lyrics: Aki Hata<br>Composition / Arrangement: Masashi Kanasaki,Love Live! Sunshine!! Unit CD Vol. 3!,"The title song of the Love Live! Sunshine!! third unit CD. The main character has a crush on ""you,"" but you seem to be slow on the uptake. Sounds like it's time for her to set a trap for you. Her assertive approach, while thrilling and fun, ultimately concludes with you falling under her spell. The lyrics and the music are a perfect match for one another, with endless excitement from the first ""Ready?""",2,203,jacket_2094,31002177,32002177,0,0,1,2016/06/08,224012901
2178,Aozora Jumping Heart (School Idol Festival AC),Aozora Jumping Heart (School Idol Festival AC),Aozora Jumping Heart,Aqours,Lyrics: Aki Hata<br>Composition: Ken Ito and Hajime Mitsumasu<br>Arrangement: EFFY,Love Live! Sunshine!! Anime Opening Theme,"The opening theme for the first season of the Love Live! Sunshine!! anime. This tried-and-true Aqours song delivers all the usual Love Live! goodness while also hinting at the start of a new chapter in the school idol story. With the fade-in like a curtain rising and the nonstop enthusiasm, this song promises a new story unfolding.",2,200,jacket_2096,31002178,32002178,0,0,1,2016/07/20,224012901
2179,Jingle Bells ga Tomaranai (School Idol Festival AC),Jingle Bells ga Tomaranai (School Idol Festival AC),Jingle Bells ga Tomaranai,Aqours,Lyrics: Aki Hata<br>Composition: Hajime Mitsumasu<br>Arrangement: EFFY,Aqours SIF Collaboration Single Vol. 1,A Love Live! School Idol Festival collaboration single. Aqours' vibrant color is alive and well in this classic Christmas carol. A live-action CM was shot for each of the nine girls.,2,200,jacket_2107,31002179,32002179,0,0,1,2016/11/23,224012901
2180,HAPPY PARTY TRAIN (School Idol Festival AC),HAPPY PARTY TRAIN (School Idol Festival AC),HAPPY PARTY TRAIN,Aqours,Lyrics: Aki Hata<br>Composition: Takuya Watanabe<br>Arrangement: EFFY,Aqours 3rd Single,"Aqours' third single. Kanan was chosen to play the song's center role through a poll. The melancholy melody forewarning departure and the world building described by the lyrics are especially memorable. This song was first toured in Aqours second tour, also called HAPPY PARTY TRAIN, in which they literally rode the train all across Japan to meet fans everywhere.",2,200,jacket_2035,31002180,32002180,0,0,1,2017/04/05,224012901
2181,Mirai no Bokura wa Shitteru yo (School Idol Festival AC),Mirai no Bokura wa Shitteru yo (School Idol Festival AC),Mirai no Bokura wa Shitteru yo,Aqours,Lyrics: Aki Hata<br>Composition: Hajime Mitsumasu<br>Arrangement: EFFY,Love Live! Sunshine!! Anime Season 2 Opening Theme,The line Let's strive for a future where we can compete with everything we havetelevises the burning frustration the Aqours girls felt when they weren't able to compete in the first season of the anime. The song describes their efforts to achieve their dream.,2,200,jacket_2044,31002181,32002181,0,0,1,2017/10/25,224012901
3001,Aion no Uta,Aion no Uta,Aion no Uta,Emma Verde (C.V: Maria Sashide),Lyrics: Ryota Saito<br>Composition / Arrangement: Kenta Urashima and Takumi Yamamoto,Nijigasaki High School Idol Club Emma Bond Episode 21 Soundtrack,"As shown in an All Stars Kizuna episode, this is the song Emma inherited from Mai Natsuka, her personal heroine, when they met at a photo studio in Switzerland. The slightly melancholy Japanese ballad and Emma's Swiss-accented singing voice combine to make a uniquely moving tune. At the live show, she gave a stirring performance with folding fans during the chorus.<br>",3,390,jacket_3003,31003001,32003001,0,0,0,2020/09/02,1
3002,Zensoku Dreamer,Zensoku Dreamer,Zensoku Dreamer,Nijigasaki High School Idol Club,Lyrics: Ayaka Miyake<br>Composition: DAICHI and Shunsuke Harada<br>Arrangement: Shunsuke Harada,,"The B-side song with NEO SKY, NEO MAP!. The dynamic opening lyrics and lead guitar instantly take listeners to a bright, happy place. At the R3BIRTH unit live show / meet & greet, the original dance patterned after a weightlifting workout became a hot topic.",3,300,jacket_3051,31003002,32003002,0,0,0,2020/11/04,1
3003,Just Believe!!!,Just Believe!!!,Just Believe!!!,Nijigasaki High School Idol Club,"Lyrics: Ayaka Miyake<br>Composition / Arrangement: ygarshy , PASSiON KiNG",,"Except for remakes of existing tunes, this is the first Nijigasaki High School Idol Club song to feature all ten members after Shioriko joined. The intro kicks off with all the girls lined up in a row, signaling that this is a new beginning. Of all the Nijigasaki songs, the fierce dancing in Just Believe!!! left a lasting impression on fans.<br>",3,300,jacket_3003,31003003,32003003,0,0,0,2020/09/02,1
3004,Fire Bird,Fire Bird,Fire Bird,Karin Asaka (C.V: Miyu Kubota),Lyrics: BEATNINE<br>Composition / Arrangement: Carlos K.,Nijigasaki High School Idol Club Karin Bond Episode 20 Soundtrack,"A song from the Nijigasaki High School Idol Club's third album. A Kizuna episode revealed Karin made this to demonstrate her passion to fan club members. The flamenco guitar, Latin rhythm, passionate dancing reminiscent of a flaming bird create an irresistible, captivating performance.<br>",3,390,jacket_3003,31003004,32003004,0,0,0,2020/09/02,1
3005,Märchen Star,Märchen Star,Märchen Star,Kanata Konoe (C.V: Akari Kito),Lyrics: Ryota Saito<br>Composition: Ryota Saito and Diz<br>Arrangement: Diz,Nijigasaki High School Idol Club Kanata Bond Episode 21 Soundtrack,"In an All Stars Kizuna episode, this was sung for the fan club to express a beautiful, dreamlike place. The unique, musical 3/4 time melody certainly transports listeners to another world.<br>",3,390,jacket_3003,31003005,32003005,0,0,0,2020/09/02,1
3006,Swinging!,Swinging!,Swinging!,QU4RTZ,Lyrics: miyakei and DAICHI<br>Composition: Keisuke Koyama and DAICHI<br>Arrangement: Keisuke Koyama,,"QU4RTZ's second single. Fans get to experience the beautiful harmonization that only QU4RTZ can produce. The girls sing as if casually swaying back and forth on a swing, and during the live show, they did exactly that, just like on the CD jacket. A mature, mid-tempo pop tune with lots of cutting guitar riffs and fancy piano playing.<br>",3,303,jacket_3006,31003006,32003006,0,0,0,2021/07/14,1
3007,Not Sad,Not Sad,Not Sad,QU4RTZ,Lyrics: Masami Kakinuma<br>Composition: Yoshihiro Suda and Takeru Yoda<br>Arrangement: Takeru Yoda,,"Like the title says, this song is all about staying positive. The lyrics ""Farewell is not the final answer, it's just the start of a brand-new path"" shows how partings don't always have to be sad. Those optimistic words of encouragement sung in beautiful harmony, speak to the heart. The path we've walked thus far connects to the next part of the journey.<br>",3,303,jacket_3006,31003007,32003007,0,0,0,2021/07/15,1
3008,Analog Heart,Analog Heart,Analog Heart,Rina Tennoji (C.V: Chiemi Tanaka),Lyrics: NOVECHIKA<br>Composition: Morito Yonezawa and Ayato Fujiwawa<br>Arrangement: JOE and Ayato Fujiwara,Nijigasaki High School Idol Club Rina Bond Episode 21 Soundtrack,"This song was performed at an online live show for a fan event in a Kizuna episode. It was done specially for a group of fans who expressed a desire to ""listen to Rina sing in a quiet environment."" The song intimately expresses Rina's desire to make friends and strengthen her bonds with others.<br>",3,390,jacket_3003,31003008,32003008,0,0,0,2020/09/02,1
3009,I'm Still...,I'm Still...,I'm Still...,Mia Taylor (C.V: Shu Uchida),Lyrics: nana hatori<br>Composition / Arrangement: Soranoalto,All Stars Story Chapter 22 Soundtrack,"Featured in All Starts story chapter 22. This song touches on Mia's past experience succumbing to the pressure of being part of the famous Taylor family to the point where she couldn't even sing. A ballad that walks through her meeting Rina, being exposed to school idols, and returning to the stage. The very first song in the Love Live! series with primarily English lyrics!",3,390,jacket_3016,31003009,32003009,0,0,0,2021/10/06,1
3010,Queendom,Queendom,Queendom,Lanzhu Zhong (C.V: Akina Homoto),Lyrics / Composition / Arrangement: BEATNINE,All Stars Story Chapter 20 Soundtrack,"Featured in All Stars story chapter 20. A grandiose, flamboyant song showcasing Lanzhu's personality that highlights the second season of the All Stars main story progression. In season 2, episode 8 of the anime Lanzhu sung the song a capella in a scene that transfixed the audience and left a lasting impression.",3,390,jacket_3016,31003010,32003010,0,0,0,2021/10/06,1
3011,Say Good-Bye Namida,Say Good-Bye Namida,Say Good-Bye Namida,Ayumu Uehara (C.V: Aguri Onishi),Lyrics / Composition: Akira Sunset<br>Arrangement: Naoki Endo,Nijigasaki High School Idol Club Ayumu Bond Episode 21 Soundtrack,"Performed by Ayumu in an All Stars Kizuna episode for her loyal fans. It carries a message of Ayumu trying to love herself more. She put her feelings directly into lyrics, and the end result is a peppy tune that leaves listeners feeling more optimistic.<br>",3,390,jacket_3003,31003011,32003011,0,0,0,2020/09/02,1
3012,Margaret,Margaret,Margaret,Kasumi Nakasu (C.V: Mayu Sagara),Lyrics: Ereca Suzuki<br>Composition / Arrangement: Carlos K.,Nijigasaki High School Idol Club Kasumi Bond Episode 20 Soundtrack,"Performed by Kasumi in an All Stars Kizuna episode. Initially upset that only her fan club numbers seemed to be stagnant, Kasumi sung this for those fans who continued to encourage her and let her true feelings out in the lyrics. This beautiful ballad admits to some weakness, and the real Kasumi underneath the school idol slips in and out of view.<br>",3,390,jacket_3003,31003012,32003012,0,0,0,2020/09/02,1
3013,LIKE IT! LOVE IT!,LIKE IT! LOVE IT!,LIKE IT! LOVE IT!,Setsuna Yuki (C.V: Tomori Kusunoki),"Lyrics: Ereca Suzuki<br>Composition: Manaka Suzuki, Hiroki Sagwa and Takeru Yoda<br>Arrangement: Takeru Yoda",Nijigasaki High School Idol Club Setsuna Bond Episode 21 Soundtrack,"Performed by Setsuna in an All Stars Kizuna episode. A song with a message! Setsuna performed this to share her love far and wide. A rock tune full of enthusiasm and zeal that's a perfect fit for Setsuna. Rather than let someone else's passion do the talking, she believes expressing herself directly is the only way to communicate how she feels.<br>",3,390,jacket_3003,31003013,32003013,0,0,0,2020/09/02,1
3014,Folklore ~Kanki no Uta~,Folklore ~Kanki no Uta~,Folklore ~Kanki no Uta~,A·ZU·NA,Lyrics: Sorano Muraki<br>Composition / Arrangement: Soranoalto,,"Appearing on the same CD as Maze Town, a high tempo song sung in a major key. The harmony and key changes in the ""Pure-rara-lu Parira-ta-ta"" interlude fit the subtitle (Ode to Joy) perfectly. It's 100% musical joy!<br>",3,302,jacket_3048,31003014,32003014,0,0,0,2021/06/16,1
3015,Muteki-kyuu*Believer,Muteki-kyuu*Believer,Muteki-kyuu*Believer,Kasumi Nakasu (C.V: Mayu Sagara),Lyrics: Ayaka Miyake<br>Composition: DECO*27<br>Arrangement: Rockwell,,"A Nijigasaki High School Idol Club single with an animated promo video. Written especially for Kasumi, it won the voter's choice for single to get an animated PV. We all have times when we look in the mirror and feel down about what's reflected back. This song's uplifting lyrics encourage us to be brave and keep moving forward.<br>",3,390,jacket_3015,31003015,32003015,0,0,0,2020/07/29,1
3016,MONSTER GIRLS,MONSTER GIRLS,MONSTER GIRLS,R3BIRTH,Lyrics / Composition / Arrangement: Dummy Dog,All Stars Story Chapter 28 Soundtrack,"R3BIRTH's first single. Mia wrote this as a challenge to Lanzhu in All Stars story chapter 28. The heavy EDM beats remind listeners that a new era is coming with the formation of this fourth unit. The lyrics for MONSTER GIRLS include Japanese, English, and Chinese, reflecting the rich multicultural diversity of the unit's members.<br>",3,304,jacket_3016,31003016,32003016,0,0,0,2021/10/06,1
3017,Audrey,Audrey,Audrey,Shizuku Osaka (C.V: Kaori Maeda),Lyrics / Composition: Tsukimisou<br>Arrangement: Hiroto Kikuchi,Nijigasaki High School Idol Club Shizuku Bond Episode 12 Soundtrack,"First appeared on the second Nijigasaki High School Idol Club album. A song prepared by the player in an All Stars Kizuna episode for Shizuku. The aim was to write a song for her to use when playing the part of her ideal school idol. The rock band sound puts it in a different genre than Shizuku's usual songs, but perhaps that makes it the perfect choice for an accomplished actress.",3,390,jacket_3047,31003017,32003017,0,0,0,2019/10/02,1
3018,Silent Blaze,Silent Blaze,Silent Blaze,Kanata Konoe (C.V: Akari Kito),Lyrics: Ereca Suzuki<br>Composition: Ereca Suzuki and Mash Tanaka<br>Arrangement: Mash Tanaka,Nijigasaki High School Idol Club Kanata Bond Episode 27 Soundtrack,"Appeared in a Kizuna episode where Kanata was put in charge of writing the manga research club's theme song for the school film festival. She expertly expresses the feelings of the song's female ninja, and the desire to fight to defend peace shines through brilliantly. Kanata and hard rock is a rare combo, but a welcome one.<br>",3,390,jacket_3044,31003018,32003018,0,0,0,2021/10/13,1
3019,Sweet Eyes,Sweet Eyes,Sweet Eyes,Nijigasaki High School Idol Club,Lyrics: Ayaka Miyake<br>Composition / Arrangement: Carlos K. and Mash Tanaka,,"B-side coupled with Nijiiro Passions!. In a rare break from their usual jams, Nijigasaki High School Idol Club put out this sugary sweet love song. The lyrics talk of a young girl's unrequired love to a lively pop melody with roots in American disco. All in all, it's a fun, peppy dance tune with fun back-and-forth lyrics.<br>",3,300,jacket_3062,31003019,32003019,0,0,0,2020/10/21,1
3020,Eieisa,Eieisa,Eieisa,Shizuku Osaka (C.V: Kaori Maeda),Lyrics: Manaka Suzuki<br>Composition: Manaka Suzuki and Tatsuki Miyazawa<br>Arrangement: Naoki Endo,Nijigasaki High School Idol Club Shizuku Bond Episode 27 Soundtrack,"Appeared in a Kizuna episode where Shizuku was put in charge of writing the drama club's opening song for the school film festival. A firm, impactful Japanese melody that depicts the unshakeable resolve of Shizuku to unite a squad of ronin.<br>",3,390,jacket_3044,31003020,32003020,0,0,0,2021/10/13,1
3021,Ye Mingzhu,Ye Mingzhu,Ye Mingzhu,Lanzhu Zhong (C.V: Akina Homoto),Lyrics / Composition / Arrangement: BEATNINE,Nijigasaki High School Idol Club Lanzhu Bond Episode 6 Soundtrack,"In a Kizuna episode, Lanzhu moved into the Nijigasaki dorms, and you, the player, wrote this to express how she felt as you watched her mingling with the other dorm residents. A real EDM banger with copious amounts of English and Chinese mixed in.<br>",3,390,jacket_3044,31003021,32003021,0,0,0,2021/10/13,1
3022,Break The System,Break The System,Break The System,Ayumu Uehara (C.V: Aguri Onishi),Lyrics / Composition: nana hitori and shun ÷1<br>Arrangement: shun ÷1,Nijigasaki High School Idol Club Ayumu Bond Episode 27 Soundtrack,"Appeared in a Kizuna episode where Ayumu was put in charge of writing the sci-fi research club's opening song for the school film festival. She wrote the lyrics herself. Though the Ayumu-ness in the track is present, you can also hear a new side of her rising to the surface in this up-tempo rock track.<br>",3,390,jacket_3044,31003022,32003022,0,0,0,2021/10/13,1
3023,Diabolic mulier,Diabolic mulier,Diabolic mulier,Ai Miyashita (C.V: Natsumi Murakami),Lyrics:T4K<br>Composition: T4K and Luis Ogata<br>Arrangement: Ryosuke Saito,Nijigasaki High School Idol Club Ai Bond Episode 27 Soundtrack,"Appeared in a Kizuna episode where Ai was put in charge of the tabletop gaming club's opening song for the school film festival. It's written from the point of view of a bewitching vampire princess. With it being so different from her usual music, it's hard not to get sucked in to listening to Ai lay down this dark, sinister refrain.<br>",3,390,jacket_3044,31003023,32003023,0,0,0,2021/10/13,1
3024,First Love Again,First Love Again,First Love Again,Rina Tennoji (C.V: Chiemi Tanaka),Lyrics: Tsukimisou<br>Composition: Tsukimisou and Takayuki Yoshimura<br>Arrangement: Takayuki Yoshimura,Nijigasaki High School Idol Club Rina Bond Episode 27 Soundtrack,"Appeared in a Kizuna episode where Rina volunteered to write the theme song for the gaming club's entry to the school film festival. It's a warm, intimate ballad that represents the film's protagonist's struggle: she can only remember one day's worth of memories.<br>",3,390,jacket_3044,31003024,32003024,0,0,0,2021/10/13,1
3025,Toy Doll,Toy Doll,Toy Doll,Mia Taylor (C.V: Shu Uchida),"Lyrics: nana hatori<br>Composition: Ryo ""Lefty"" Miyata and Carlos K.<br>Arrangement: Konnie Aoki",Nijigasaki High School Idol Club Mia Bond Episode 6 Soundtrack,"Written by Mia in a Kizuna episode. After joining the School Idol Club, Mia decided she would sing because she wanted to, even if everything wasn't perfect, and came up with this song. The first song in the Love Live! series to be sung entirely in English!<br>",3,390,jacket_3044,31003025,32003025,0,0,0,2021/10/13,1
3026,Concentrate!,Concentrate!,Concentrate!,Shioriko Mifune (C.V: Moeka Koizumi),Lyrics: Sorano Muraki<br>Composition / Arrangement: Soranoalto,Nijigasaki High School Idol Club Shioriko Bond Episode 14 Soundtrack,Appeared in a Kizuna episode where Shioriko wrote it to promote the student council's movie. She unveiled it the night before. Shioriko's personality shines through with a rollicking humdinger of a swing tune.<br>,3,390,jacket_3044,31003026,32003026,0,0,0,2021/10/13,1
3027,Yada!,Yada!,Yada!,Setsuna Yuki (C.V: Tomori Kusunoki),Lyrics: Akira Sunset<br>Composition: Akira Sunset and Hiroto Kikuchi<br>Arrangement: Hiroto Kikuchi,Nijigasaki High School Idol Club Setsuna Bond Episode 27 Soundtrack,"Appeared in a Kizuna episode where Setsuna was put in charge of the light novel research club's opening song for the school film festival. She sang it to express her own infatuations. Much like the younger sister in the club's movie, the beat and melody are a little bratty but mainly just really adorable.<br>",3,390,jacket_3044,31003027,32003027,0,0,0,2021/10/13,1
3028,Turn it Up!,Turn it Up!,Turn it Up!,Karin Asaka (C.V: Miyu Kubota),Lyrics: Akira Sunset<br>Composition: Akira Sunset and Naoki Endo<br>Arrangement: Naoki Endo,Nijigasaki High School Idol Club Karin Bond Episode 27 Soundtrack,"Appeared in a Kizuna episode where Karin was put in charge of the cinema studies club's opening song for the school film festival. You, the player, wrote the lyrics, inspired by watching Karin practice the saxophone after observing the film's actors. It's a breezy, memorable melody that makes you feel young again.",3,390,jacket_3044,31003028,32003028,0,0,0,2021/10/13,1
3029,Itsu datte for you!,Itsu datte for you!,Itsu datte for you!,Emma Verde (C.V: Maria Sashide),Lyrics: Ereca Suzuki and Carlos K.<br>Composition: Morito Yonezawa and Ayato Fujiwara<br>Arrangement: Ayato Fujiwara,Nijigasaki High School Idol Club Emma Bond Episode 27 Soundtrack,"Appeared in a Kizuna episode where Emma was tasked to help with the animation research club's promo material for the school film festival. She assisted you, the player, with finalizing the vision for the song after the ""great maid mission."" The song is a testament to Emma's cute charms.",3,390,jacket_3044,31003029,32003029,0,0,0,2021/10/13,1
3030,TO BE YOURSELF,TO BE YOURSELF,TO BE YOURSELF,Kasumi Nakasu (C.V: Mayu Sagara),Lyrics: Ryota Saito<br>Composition: Ryota Saito and Diz<br>Arrangement: Diz,Nijigasaki High School Idol Club Kasumi Bond Episode 27 Soundtrack,"Appeared in a Kizuna episode where Kasumi was put in charge of the magical girl club's opening song for the school film festival. She fully immersed herself in the role of a magical girl. Kasumi's song gives listeners the courage to press onward, much like those magical girls who are always working diligently behind the scenes.<br>",3,390,jacket_3044,31003030,32003030,0,0,0,2021/10/13,1
3031,THE SECRET NIGHT,THE SECRET NIGHT,THE SECRET NIGHT,DiverDiva,Lyrics / Composition / Arrangement: Dummy Dog,,"DiverDiva's trademark contrast between Ai's rapping and Karin's carefree singing are on full display in this song. No doubt that Ai and Karin's nose-to-nose dancing set many fans' hearts racing. This mid-tempo EDM banger is easy to picture getting play time at the club. Makes you want to start dancing now, doesn't it?<br>",3,301,jacket_3031,31003031,32003031,0,0,0,2021/05/26,1
